"...1","id","group","revenue_group","transboundary","type","Ult_BO","Multi_ent"
621,"Sea Luxe S.p.A. Seafarer","Multi-Industry Company","Medium","no","Company",NA,NA
622,"Sea Seekers Corporation Mussel","unknown","Medium","no","Company",NA,NA
623,"Sea Spray AS Cargo","Multi-Industry Company","Low","no","Company",NA,NA
624,"Sea Spray GmbH & Co. KG Services","Industrial Company","Low","no","Company",NA,NA
625,"Sea Spray Starfish N.V. Overseas","Fishing-related Company","Low","no","Company",NA,NA
626,"Sea Spray Tsunami Company Transport","unknown","High","no","Company",NA,NA
627,"Sea Star AB Investment","Food Company","Medium","no","Company",NA,NA
628,"Sea Star Company Sandbar","Consumer-goods Company","Medium","no","Company",NA,NA
629,"Sea Star Ltd. Liability Co","Consumer-goods Company","Medium","no","Company",NA,NA
630,"Sea Striders BV Shipping","Consumer-goods Company","Medium","no","Company",NA,NA
631,"Sea Striders Kelp BV Solutions","Fishing-related Company","Unreported","no","Company",NA,NA
632,"Sea Striders Swordfish Pic Freight","Multi-Industry Company","Low","no","Company",NA,NA
633,"SeaBass &  LC Marine life","Food Company","Low","no","Company",NA,NA
634,"SeaBass &  N.V. Marine ecology","Consumer-goods Company","Low","no","Company",NA,NA
635,"SeaBass Company Limited Liability Company Marine biology","unknown","Medium","no","Company",NA,NA
636,"SeaBite Marina Oyj Line","Consumer-goods Company","Low","no","Company",NA,NA
637,"SeaBite Nautilus A/S Marine biology","Multi-Industry Company","Medium","no","Company",NA,NA
638,"SeaBounty Tidepool AG Merchants","Transport-logistics Company","High","no","Company",NA,NA
639,"SeaFarms  Ltd. Corporation Marine conservation","Food Company","Low","no","Company",NA,NA
640,"SeaFarms Limited Liability Company","unknown","Medium","no","Company",NA,NA
641,"SeaScape Foods Coral Inc Marine ecology","unknown","Unreported","no","Company",NA,NA
642,"SeaScape Foods Corporation Compass","unknown","High","no","Company",NA,NA
643,"SeaScape Foods N.V. Transit","unknown","Unreported","no","Company",NA,NA
644,"SeaSiren Beachcomber AG Transport","Industrial Company","Unreported","no","Company",NA,NA
645,"SeaSiren GmbH Marine ecology","Consumer-goods Company","Medium","no","Company",NA,NA
646,"SeaSolutions Leska Kga Worldwide","Seafood-processing Company","Medium","no","Company",NA,NA
647,"SeaSplash Foods Ltd. Liability Co Express","Seafood-processing Company","Medium","no","Company",NA,NA
648,"Seafarer's Club S.A. de C.V. Transit","Food Company","High","no","Company",NA,NA
649,"Seafaring Souls Fish  Inc Transportation","unknown","Unreported","no","Company",NA,NA
650,"Seashell Sanctum Co Family","Industrial Company","Low","no","Company",NA,NA
651,"Seashell Seekers Sp Transit","unknown","Unreported","no","Company",NA,NA
652,"Seashell s  Limited Liability Company Buoy","Seafood-processing Company","Low","no","Company",NA,NA
653,"Seashell s  Oyj Worldwide","unknown","Unreported","no","Company",NA,NA
654,"Seashore Sanctuary Marine life","Fishing-related Company","Low","no","Company",NA,NA
655,"Seashore Sanctuary S.p.A. Marine","Transport-logistics Company","Low","no","Company",NA,NA
656,"Seashore Sanctuary Salt spray","Transport-logistics Company","Low","no","Company",NA,NA
657,"Seaside Summit Tidal Incorporated Line","Fishing-related Company","Low","no","Company",NA,NA
658,"Selous Game Reserve  Corp","unknown","High","no","Company",NA,NA
659,"Senegal Coast  Dredge NV Transit","Consumer-goods Company","Unreported","no","Company",NA,NA
660,"Senegal Coast  Inc Cargo","Consumer-goods Company","Low","no","Company",NA,NA
661,"Serengeti  Inc. America A/S Line","Consumer-goods Company","Unreported","no","Company",NA,NA
662,"Shou gan  Ltd. Liability Co Breakwater","unknown","Medium","no","Company",NA,NA
663,"Shou gan  SE Delivery","Food Company","Low","no","Company",NA,NA
664,"Sikkim   SRL & Son's","unknown","Medium","no","Company",NA,NA
665,"Sikkim  GmbH & Co. KG","Multi-Industry Company","Unreported","no","Company",NA,NA
666,"Sikkim  Limited Liability Company","unknown","Medium","no","Company",NA,NA
667,"SilverScales GmbH & Co. KG","Multi-Industry Company","Low","no","Company",NA,NA
668,"SilverScales Limited Liability Company","unknown","High","no","Company",NA,NA
669,"Simien Mountains   GmbH Forwading","unknown","Unreported","no","Company",NA,NA
670,"Solutions Limited Liability Company","Seafood-processing Company","Unreported","yes","Company",NA,NA
671,"Southeast Ltd. Liability Co Investment","Consumer-goods Company","Medium","no","Company",NA,NA
672,"Spanish  Nautilus Co Export","unknown","High","no","Company",NA,NA
673,"Spanish Anchovy GmbH & Co. KG","Transport-logistics Company","Low","no","Company",NA,NA
674,"Spanish Mackerel OJSC Cargo","unknown","Unreported","no","Company",NA,NA
675,"Spanish Red Snapper BV","unknown","Unreported","no","Company",NA,NA
676,"Spanish Red Snapper Current Ges.m.b.H. Line","Seafood-processing Company","Medium","no","Company",NA,NA
677,"Spanish Red Snapper Holdings","unknown","Unreported","no","Company",NA,NA
678,"Sparrman's bream Tidal LC Carriers","unknown","Unreported","no","Company",NA,NA
679,"Surf and Sand A/S Marine life","unknown","Medium","no","Company",NA,NA
680,"Surf's Up  Kga Marine","unknown","Medium","no","Company",NA,NA
681,"Surf's Up  LLC Transportation","unknown","Unreported","no","Company",NA,NA
682,"Surf's Up s N.V.","Consumer-goods Company","Unreported","no","Company",NA,NA
683,"Surf's Up s ОАО Solutions","unknown","High","no","Company",NA,NA
684,"Tamil Nadu   Corporation Compass","unknown","Unreported","no","Company",NA,NA
685,"Tamil Nadu   LC Marine life","Transport-logistics Company","Low","no","Company",NA,NA
686,"Tamil Nadu   Ltd. Liability Co","unknown","Unreported","no","Company",NA,NA
687,"Tamil Nadu  Market Ltd. Corporation","Transport-logistics Company","Medium","no","Company",NA,NA
688,"Tamil Nadu  Market Sagl","unknown","Medium","no","Company",NA,NA
689,"Tamil Nadu s SE","Multi-Industry Company","Low","no","Company",NA,NA
690,"Tana River  GmbH & Co. KG Consultants","unknown","Unreported","no","Company",NA,NA
691,"Tangier Coast  N.V. Tidal flat","Food Company","Low","no","Company",NA,NA
692,"Telangana  S.A. de C.V.","Multi-Industry Company","Low","yes","Company",NA,NA
693,"Thalassa Ferry Ltd. Liability Co Worldwide","unknown","Medium","no","Company",NA,NA
694,"The Salted Pearl - Oyj Marine conservation","Seafood-processing Company","Low","no","Company",NA,NA
695,"The Salted Pearl America Ltd Transit","unknown","Medium","no","Company",NA,NA
696,"The Salted Pearl Pic Export","Multi-Industry Company","Unreported","no","Company",NA,NA
697,"The Salty Dog Distribution","Consumer-goods Company","Low","no","Company",NA,NA
698,"The Salty Dog Ges.m.b.H.","Food Company","Low","no","Company",NA,NA
699,"The Salty Pearl A/S","unknown","Unreported","no","Company",NA,NA
700,"The Salty Pearl Buoy","unknown","High","no","Company",NA,NA
701,"The Salty Pearl GmbH","Multi-Industry Company","Low","no","Company",NA,NA
702,"The Salty Pearl Pic","Industrial Company","Low","no","Company",NA,NA
703,"The Sea Lion N.V. Cargo","Industrial Company","Low","no","Company",NA,NA
704,"The Sea Turtle Company","Food Company","Low","no","Company",NA,NA
705,"The Sea Turtle GmbH & Co. KG Freight","Fishing-related Company","Unreported","no","Company",NA,NA
706,"The Sea Turtle Seagull Kga Line","Consumer-goods Company","Medium","no","Company",NA,NA
707,"Thetis S.A. de C.V. Marine conservation","unknown","High","no","Company",NA,NA
708,"Thoho Tidal flat AG Merchants","unknown","Medium","no","Company",NA,NA
709,"Tiao piao  Limited Liability Company","Seafood-processing Company","Medium","no","Company",NA,NA
710,"Tiao piao  Ltd. Corporation","Transport-logistics Company","Low","no","Company",NA,NA
711,"Tiao piao  Ltd. Liability Co","Seafood-processing Company","Low","no","Company",NA,NA
712,"Tiao piao  Sagl Services","unknown","Unreported","no","Company",NA,NA
713,"Tide Turners Limited Liability Company United","unknown","Medium","no","Company",NA,NA
714,"TideTable Compass Kga Marine","unknown","Medium","no","Company",NA,NA
715,"TideTable SRL Marine sanctuary","Consumer-goods Company","Low","no","Company",NA,NA
716,"Transit Limited Liability Company","Fishing-related Company","Unreported","yes","Company",NA,NA
717,"Tripura  Market Tsunami Pic Transport","unknown","Medium","no","Company",NA,NA
718,"Tsha wamba S.A. de C.V.","unknown","Medium","no","Company",NA,NA
719,"TunaTime Ltd. Liability Co Line","unknown","High","no","Company",NA,NA
720,"TunaTime Tidal flat Sp Worldwide","unknown","Unreported","no","Company",NA,NA
721,"TunaTreat Seagrass BV Solutions","unknown","Medium","no","Company",NA,NA
722,"TunaTreat Surf Inc Express","Transport-logistics Company","Medium","no","Company",NA,NA
723,"TunaTreats LLC Marine life","Food Company","Medium","no","Company",NA,NA
724,"Turkish  Marine ecology Ges.m.b.H. Carriers","Multi-Industry Company","Low","no","Company",NA,NA
725,"Turkish Mussels Ltd. Corporation Logistics","Multi-Industry Company","Low","no","Company",NA,NA
726,"Turkish Mussels Tsunami Ltd Services","Transport-logistics Company","Medium","no","Company",NA,NA
727,"Turkish Salmon A/S Marine","unknown","High","no","Company",NA,NA
728,"Turkish Salmon AB Marine biology","unknown","High","no","Company",NA,NA
729,"Turkish Salmon GmbH & Co. KG","unknown","Medium","no","Company",NA,NA
730,"Turkish Sword GmbH & Co. KG Delivery","Food Company","Low","no","Company",NA,NA
731,"Turkish Sword N.V. Logistics","Transport-logistics Company","Low","no","Company",NA,NA
732,"Turkish Sword Oyj Brothers","unknown","High","no","Company",NA,NA
733,"Uttar Pradesh Sea  Company Seafoam","Multi-Industry Company","Low","no","Company",NA,NA
734,"Uttar Pradesh s Co","Food Company","Low","no","Company",NA,NA
735,"Uttar Pradesh s Ges.m.b.H.","Industrial Company","Unreported","no","Company",NA,NA
736,"Uttar Pradesh s Shipyard","unknown","Unreported","no","Company",NA,NA
737,"Uttarakhand s Plc Forwading","Consumer-goods Company","Unreported","no","Company",NA,NA
738,"Vespuci Limited Liability Company","Industrial Company","Unreported","no","Company",NA,NA
739,"Victoria Falls   Limited Liability Company","Transport-logistics Company","Low","no","Company",NA,NA
740,"Victoria Falls   Plc Transport","Multi-Industry Company","Medium","no","Company",NA,NA
741,"Viento Azul Incorporated Forwading","Transport-logistics Company","Low","no","Company",NA,NA
742,"Viento y Mar BV","Seafood-processing Company","Low","no","Company",NA,NA
743,"Viento y Mar LLC Export","Industrial Company","Low","no","Company",NA,NA
744,"Viento y Mar Sailboat","Food Company","High","no","Company",NA,NA
745,"Vleikurper Ltd. Liability Co","Consumer-goods Company","Unreported","no","Company",NA,NA
746,"Volga River LC Services","Fishing-related Company","Low","no","Company",NA,NA
747,"Volga River S.A. de C.V.","unknown","Medium","no","Company",NA,NA
748,"Water Wonders Limited Liability Company","Fishing-related Company","Low","yes","Company",NA,NA
749,"Water World GmbH & Co. KG","Consumer-goods Company","Low","no","Company",NA,NA
750,"Water World Kga Consultants","unknown","Unreported","no","Company",NA,NA
751,"Water World Ltd. Liability Co Brothers","Seafood-processing Company","Low","no","Company",NA,NA
752,"Water World Marine conservation","Consumer-goods Company","Medium","no","Company",NA,NA
753,"Wave Riders & AS Marine ecology","Multi-Industry Company","High","no","Company",NA,NA
754,"Wave Riders Sp Transport","unknown","Medium","no","Company",NA,NA
755,"Wave Warriors SE Freight","unknown","Medium","no","Company",NA,NA
756,"West Bengal  A/S Import","Industrial Company","Unreported","no","Company",NA,NA
757,"West Bengal  Ltd. Corporation","Fishing-related Company","Low","yes","Company",NA,NA
758,"West Bengal  OJSC Freight","Food Company","Low","no","Company",NA,NA
759,"West Kga and Son's","Multi-Industry Company","Medium","no","Company",NA,NA
760,"West _ GmbH & Co. KG Transit","Transport-logistics Company","Unreported","no","Company",NA,NA
761,"Whale S.A. de C.V. Line","Food Company","High","no","Company",NA,NA
762,"Yenisei  Eel GmbH & Co. KG Services","Fishing-related Company","Low","yes","Company",NA,NA
763,"Yu er he  N.V.","Multi-Industry Company","Low","no","Company",NA,NA
764,"Yu er he  Sea","Industrial Company","Unreported","no","Company",NA,NA
765,"Yu er he  Solutions","Multi-Industry Company","Low","no","Company",NA,NA
766,"Yu er he  Trout Sagl Transport","unknown","Low","no","Company",NA,NA
767,"Yu gan  AG Consulting","unknown","Medium","no","Company",NA,NA
768,"Yu gan  Sea spray GmbH Industrial","unknown","Unreported","no","Company",NA,NA
769,"Zambezi Delta  Ltd Marine life","unknown","High","no","Company",NA,NA
770,"Zambezi Escarpment  Salt spray Incorporated Export","unknown","Medium","no","Company",NA,NA
771,"Znamensk Ltd. Liability Co","Industrial Company","Low","no","Company",NA,NA
772,"Znamensk Mussel AB Forwading","unknown","Unreported","no","Company",NA,NA
773,"bái suō wěn lú CJSC","Seafood-processing Company","Low","no","Company",NA,NA
774,"fēi yú Express Aqua","Consumer-goods Company","Unreported","no","Company",NA,NA
775,"fēi yú N.V. and Son's","Food Company","Medium","no","Company",NA,NA
776,"guī yú Kga Cargo","Consumer-goods Company","Low","no","Company",NA,NA
777,"guī yú Ltd. Corporation","Food Company","Low","no","Company",NA,NA
778,"guī yú N.V. Catchers","Seafood-processing Company","Unreported","no","Company",NA,NA
779,"hǎi dǎn Co Transport","Multi-Industry Company","Low","no","Company",NA,NA
780,"hǎi mǎ & N.V. Forwading","unknown","High","no","Company",NA,NA
781,"hǎi tún Incorporated Marine","unknown","Medium","no","Company",NA,NA
782,"jīn qiāng yú Company","unknown","Unreported","no","Company",NA,NA
783,"jīn qiāng yú Transport Shark","unknown","High","no","Company",NA,NA
784,"jīng Coral LLC Carriers","Transport-logistics Company","Low","no","Company",NA,NA
785,"jīng Ltd. Corporation Otter","Food Company","Low","no","Company",NA,NA
786,"katushka S.A. de C.V.","unknown","Unreported","no","Company",NA,NA
787,"katushka S.A. de C.V. Surfboard","unknown","High","no","Company",NA,NA
788,"lú yú A/S Marine","Multi-Industry Company","Low","no","Company",NA,NA
789,"lǐyú Hijiki Pic Worldwide","unknown","High","no","Company",NA,NA
790,"móguǐ yú LLC Forwading","Multi-Industry Company","Low","no","Company",NA,NA
791,"móguǐ yú Ltd. Liability Co","unknown","High","no","Company",NA,NA
792,"nián yú GmbH Investment","Multi-Industry Company","Medium","no","Company",NA,NA
793,"nián yú Jetty SE Forwading","Consumer-goods Company","Low","no","Company",NA,NA
794,"páng xiè Marine life BV Enterprises","unknown","High","no","Company",NA,NA
795,"qīng yú AS Transit","unknown","High","no","Company",NA,NA
796,"shí rén yú BV","unknown","High","no","Company",NA,NA
797,"shí rén yú Barge","Consumer-goods Company","Low","no","Company",NA,NA
798,"shí rén yú Marine life","Transport-logistics Company","Low","no","Company",NA,NA
799,"suō yú Breakwater Oyj and Son's","Consumer-goods Company","Unreported","no","Company",NA,NA
800,"suō yú Limited Liability Company","unknown","Unreported","no","Company",NA,NA
801,"suō yú Ltd. Liability Co","Fishing-related Company","Low","no","Company",NA,NA
802,"xún yú AB Consultants","Transport-logistics Company","Medium","no","Company",NA,NA
803,"xún yú Inc Line","Transport-logistics Company","Medium","no","Company",NA,NA
804,"xún yú Incorporated and Son's","Consumer-goods Company","Medium","no","Company",NA,NA
805,"Saharan Coast  BV Marine","unknown","Unreported","unknown","Company",NA,NA
806,"Olas del Sur Estuary","unknown","Unreported","unknown","Company",NA,NA
807,"Bahía de Coral Kga","unknown","Unreported","unknown","Company",NA,NA
808,"Náutica del Sol Kga","unknown","Unreported","unknown","Company",NA,NA
809,"Mar de la Luz BV","unknown","Unreported","unknown","Company",NA,NA
810,"Big Sulphur  Ltd. Liability Co","unknown","Unreported","unknown","Company",NA,NA
811,"Olas del Sur A/S Holdings","unknown","Unreported","unknown","Company",NA,NA
812,"Brisa del Este Cargo Bonito","unknown","Unreported","unknown","Company",NA,NA
813,"Sea Harvest Marine conservation CJSC Marine","unknown","Unreported","unknown","Company",NA,NA
814,"Estrella de Mar Company","unknown","Unreported","unknown","Company",NA,NA
815,"Irish Trout S.p.A. Carriers","unknown","Unreported","unknown","Company",NA,NA
816,"Barents Sea Shrimp GmbH & Co. KG Cargo","unknown","Unreported","unknown","Company",NA,NA
817,"bái suō wěn lú GmbH","unknown","Unreported","unknown","Company",NA,NA
818,"Matshakala Pic and Son's","unknown","Unreported","unknown","Company",NA,NA
819,"Mar de la Aventura AB","unknown","Unreported","unknown","Company",NA,NA
820,"Surf's Up s America Plc Solutions","unknown","Unreported","unknown","Company",NA,NA
821,"4 S.A. de C.V.","unknown","Unreported","unknown","Company",NA,NA
822,"Uttarakhand  Market Sp Bonito","unknown","Unreported","unknown","Company",NA,NA
823,"Bahía del Este AG","unknown","Unreported","unknown","Company",NA,NA
824,"South Marine conservation Sagl Solutions","unknown","Unreported","unknown","Company",NA,NA
825,"Arunachal Pradesh s Ltd. Liability Co Marine sanctuary","unknown","Unreported","unknown","Company",NA,NA
826,"Turkish Sword Sagl Seafarer","unknown","Unreported","unknown","Company",NA,NA
827,"Barco de Plata SE Carriers","unknown","Unreported","unknown","Company",NA,NA
828,"Playa del Sol Sandbar LLC Enterprises","unknown","Unreported","unknown","Company",NA,NA
829,"xiǎo lóng xiā AG","unknown","Unreported","unknown","Company",NA,NA
830,"Olas del Mar OJSC and","unknown","Unreported","unknown","Company",NA,NA
831,"Coral del Cielo Shipping","unknown","Unreported","unknown","Company",NA,NA
832,"2 Ltd. Liability Co","unknown","Unreported","unknown","Company",NA,NA
833,"Zambezi River   S.A. de C.V. Carriers","unknown","Unreported","unknown","Company",NA,NA
834,"CoralCrest Ltd. Corporation Cargo","unknown","Unreported","unknown","Company",NA,NA
835,"Water World Limited Liability Company Freight","unknown","Unreported","unknown","Company",NA,NA
836,"Adriatic Catch SRL Line","unknown","Unreported","unknown","Company",NA,NA
837,"AquaDelight Corp Marine ecology","unknown","Unreported","unknown","Company",NA,NA
838,"Karnataka Sea  ОАО Consultants","unknown","Unreported","unknown","Company",NA,NA
839,"Faroe Islands Crab NV","unknown","Unreported","unknown","Company",NA,NA
840,"SeaScape Foods Ltd. Liability Co Delivery","unknown","Unreported","unknown","Company",NA,NA
841,"Mar de Cristalino Inc","unknown","Unreported","unknown","Company",NA,NA
842,"Savaneta SE Marine conservation","unknown","Unreported","unknown","Company",NA,NA
843,"SeaSplash Foods Corporation Freight","unknown","Unreported","unknown","Company",NA,NA
844,"Jammu GmbH & Co. KG","unknown","Unreported","unknown","Company",NA,NA
845,"Victoria Falls   Cargo ship","unknown","Unreported","unknown","Company",NA,NA
846,"Playa del Tesoro S.A. de C.V. Line","unknown","Unreported","unknown","Company",NA,NA
847,"Playa de Arena NV Logistics","unknown","Unreported","unknown","Company",NA,NA
848,"Scottish Lobster Ltd. Corporation","unknown","Unreported","unknown","Company",NA,NA
849,"Group Ray LLC Transportation","unknown","Unreported","unknown","Company",NA,NA
850,"Volga River Navigation SE Marine biology","unknown","Unreported","unknown","Company",NA,NA
851,"Greek Mackerel Aqua Inc United","unknown","Unreported","unknown","Company",NA,NA
852,"Benguela Current   Marine sanctuary","unknown","Unreported","unknown","Company",NA,NA
853,"SilverScales Aquatic GmbH & Co. KG Carriers","unknown","Unreported","unknown","Company",NA,NA
854,"Surf and Sand Ltd","unknown","Unreported","unknown","Company",NA,NA
855,"Mar del Placer Ltd Delivery","unknown","Unreported","unknown","Company",NA,NA
856,"Danish Shrimp Ltd. Corporation","unknown","Unreported","unknown","Company",NA,NA
857,"Sahara  LLC Investment Sea","unknown","Unreported","unknown","Company",NA,NA
858,"Dnipro  & CJSC Consultants","unknown","Unreported","unknown","Company",NA,NA
859,"Marine Mermaids Incorporated Consultants","unknown","Unreported","unknown","Company",NA,NA
860,"Surf and Sand Eel","unknown","Unreported","unknown","Company",NA,NA
861,"Océano Azul GmbH Shipping","unknown","Unreported","unknown","Company",NA,NA
862,"Bay of Bengal's N.V. and Son's","unknown","Unreported","unknown","Company",NA,NA
863,"Great Ruaha River  Yacht","unknown","Unreported","unknown","Company",NA,NA
864,"Bahía de Coral Plc Export","unknown","Unreported","unknown","Company",NA,NA
865,"Estrella de Mar ОАО","unknown","Unreported","unknown","Company",NA,NA
866,"Ronan N.V. Marine ecology","unknown","Unreported","unknown","Company",NA,NA
867,"Estrella de Mar Company Tilapia","unknown","Unreported","unknown","Company",NA,NA
868,"Nautical Navigators Sp Express","unknown","Unreported","unknown","Company",NA,NA
869,"Bahía del Este Corporation","unknown","Unreported","unknown","Company",NA,NA
870,"Volga River Sagl Logistics","unknown","Unreported","unknown","Company",NA,NA
871,"Bahía del Sol Catfish Corporation Marine","unknown","Unreported","unknown","Company",NA,NA
872,"Hohhot Limited Liability Company","unknown","Unreported","unknown","Company",NA,NA
873,"Italian  A/S & Son's","unknown","Unreported","unknown","Company",NA,NA
874,"Greek Mackerel Hull Inc Export","unknown","Unreported","unknown","Company",NA,NA
875,"Rift Valley fishery Co Cargo","unknown","Unreported","unknown","Company",NA,NA
876,"Olas del Mar Company","unknown","Unreported","unknown","Company",NA,NA
877,"Maacama  Oceanography ОАО Worldwide","unknown","Unreported","unknown","Company",NA,NA
878,"S.A. de C.V. Sp","unknown","Unreported","unknown","Company",NA,NA
879,"WaterWorld NV & Son's","unknown","Unreported","unknown","Company",NA,NA
880,"OceanKing s Sp Line","unknown","Unreported","unknown","Company",NA,NA
881,"Surf and Sand Dashi AG Transit","unknown","Unreported","unknown","Company",NA,NA
882,"Jammu Sextant AG Investment","unknown","Unreported","unknown","Company",NA,NA
883,"Briny - Pic Transit","unknown","Unreported","unknown","Company",NA,NA
884,"Balkan Anchovy N.V. Transit","unknown","Unreported","unknown","Company",NA,NA
885,"Surf's Up  S.p.A. Worldwide","unknown","Unreported","unknown","Company",NA,NA
886,"Seafarer's Club ОАО Line","unknown","Unreported","unknown","Company",NA,NA
887,"Arena de Coral S.A. de C.V.","unknown","Unreported","unknown","Company",NA,NA
888,"Vespuci Marine ecology Seabed","unknown","Unreported","unknown","Company",NA,NA
889,"Estrella del Mar Ltd. Corporation","unknown","Unreported","unknown","Company",NA,NA
890,"Ianira Limited Liability Company Marine","unknown","Unreported","unknown","Company",NA,NA
891,"Guinea Gulf  LC Forwading","unknown","Unreported","unknown","Company",NA,NA
892,"Amur  Laksa S.A. de C.V. Investment","unknown","Unreported","unknown","Company",NA,NA
893,"nián yú Ltd. Corporation Transit","unknown","Unreported","unknown","Company",NA,NA
894,"Skeleton Coast  Kga Cargo","unknown","Unreported","unknown","Company",NA,NA
895,"Caracola del Sol LC","unknown","Unreported","unknown","Company",NA,NA
896,"Mar de la Luna SE","unknown","Unreported","unknown","Company",NA,NA
897,"Seaside Summit _ Oyj Express","unknown","Unreported","unknown","Company",NA,NA
898,"Caspian Sea   Ray LC Marine sanctuary","unknown","Unreported","unknown","Company",NA,NA
899,"Whale Swordfish Inc Marine","unknown","Unreported","unknown","Company",NA,NA
900,"James and Company Consultants","unknown","Unreported","unknown","Company",NA,NA
901,"Selous Game Reserve  AB","unknown","Unreported","unknown","Company",NA,NA
902,"Coral Kingdom Limited Liability Company Investment","unknown","Unreported","unknown","Company",NA,NA
903,"Henan Fish SE Holdings","unknown","Unreported","unknown","Company",NA,NA
904,"Olas del Sur Sagl","unknown","Unreported","unknown","Company",NA,NA
905,"Estrella del Mar AB Marine conservation","unknown","Unreported","unknown","Company",NA,NA
906,"Bahía de Plata GmbH Cargo","unknown","Unreported","unknown","Company",NA,NA
907,"Caracola del Este Cargo","unknown","Unreported","unknown","Company",NA,NA
908,"Dutch Bill  AG Industrial","unknown","Unreported","unknown","Company",NA,NA
909,"West Bengal  Co _","unknown","Unreported","unknown","Company",NA,NA
910,"Belgian Lobster Ltd. Liability Co and Son's","unknown","Unreported","unknown","Company",NA,NA
911,"Atlántico Sur Corporation Breakwater","unknown","Unreported","unknown","Company",NA,NA
912,"Náutica del Sol Pelican","unknown","Unreported","unknown","Company",NA,NA
913,"Bahía de Plata Plc Transport","unknown","Unreported","unknown","Company",NA,NA
914,"Aqua Ventures A/S Transport","unknown","Unreported","unknown","Company",NA,NA
915,"Mar de Coral Marine life","unknown","Unreported","unknown","Company",NA,NA
916,"Mar del Este SE","unknown","Unreported","unknown","Company",NA,NA
917,"Cape of Good Hope   AS","unknown","Unreported","unknown","Company",NA,NA
918,"Madhya Pradesh   Corp Merchants","unknown","Unreported","unknown","Company",NA,NA
919,"Mar del Caribe Corp","unknown","Unreported","unknown","Company",NA,NA
920,"Kariba Dam   CJSC Holdings","unknown","Unreported","unknown","Company",NA,NA
921,"Bahía de Plata Pic Marine","unknown","Unreported","unknown","Company",NA,NA
922,"Ola de la Costa Tidal Incorporated Worldwide","unknown","Unreported","unknown","Company",NA,NA
923,"Belgian Scallop Charter Boat  Inc Freight","unknown","Unreported","unknown","Company",NA,NA
924,"Delphinia Seagrass GmbH Marine sanctuary","unknown","Unreported","unknown","Company",NA,NA
925,"Perla del Mar Ltd","unknown","Unreported","unknown","Company",NA,NA
926,"Mar y Viento AS","unknown","Unreported","unknown","Company",NA,NA
927,"Gujarat  Limited Liability Company Logistics","unknown","Unreported","unknown","Company",NA,NA
928,"Dubingiai Marine sanctuary Surfboard","unknown","Unreported","unknown","Company",NA,NA
